{
  "schema_version": "1.0.0",
  "programme_version": "0.2.0",
  "current_release": "0.2.0",
  "stable_release": "1.0.0",
  "releases": [
    {
      "version": "0.2.0",
      "name": "v1 roadmap and maturity architecture",
      "channel": "experimental",
      "maturity_level": "M1",
      "objective": "Make the path to stable v1 explicit, dependency-complete and machine-enforceable.",
      "required_tracks": [
        "accessibility_network_engine_20260719",
        "canonical_domain_schemas_ontology_20260719",
        "connector_runtime_capture_20260719",
        "documentation_developer_experience_20260719",
        "emergency_health_facilities_pilot_20260718",
        "facility_location_engine_20260718",
        "facility_registry_20260719",
        "foundation_architecture_20260718",
        "governance_maori_data_sovereignty_20260718",
        "health_outcomes_causal_methods_20260719",
        "interoperability_conformance_sdks_20260719",
        "methods_research_objects_20260718",
        "nz_spatial_archive_mvp_20260718",
        "nz_spatial_archive_operations_20260719",
        "nz_spatial_source_registry_20260718",
        "operations_preservation_sre_20260719",
        "performance_scalability_reliability_20260719",
        "planning_rules_linkage_20260718",
        "planning_system_transition_20260719",
        "provenance_profile_v1_20260718",
        "provenance_query_api_20260719",
        "publication_validation_20260718",
        "repository_template_adoption_20260718",
        "security_supply_chain_20260719",
        "simulation_validation_engine_20260719",
        "spatial_quality_temporality_20260718",
        "supermarket_health_pilot_20260718",
        "v1_release_hardening_20260719"
      ],
      "exit_gates": [
        {
          "id": "roadmap-complete",
          "category": "governance",
          "requirement": "The complete v1 scope, ownership, dependencies and release authority are explicit.",
          "evidence_contract": [
            "Validated 28-track graph",
            "Named ownership matrix",
            "Approved programme boundary"
          ],
          "blocking": true
        },
        {
          "id": "maturity-model-enforced",
          "category": "contracts",
          "requirement": "Maturity levels, dimensions, release gates and evidence rules are machine-validated.",
          "evidence_contract": [
            "Maturity and release schemas",
            "Roadmap validation test report",
            "Generated issue drift check"
          ],
          "blocking": true
        },
        {
          "id": "risk-and-boundaries",
          "category": "science",
          "requirement": "Legal, clinical, causal, operational and data-authority boundaries are explicit.",
          "evidence_contract": [
            "Risk register",
            "Intended-use and non-authority statements",
            "Review record"
          ],
          "blocking": true
        },
        {
          "id": "roadmap-reproducible",
          "category": "release",
          "requirement": "The roadmap, tracks and issue graph regenerate deterministically from versioned sources.",
          "evidence_contract": [
            "Deterministic generation result",
            "Repository checksum manifest",
            "Clean-environment verification"
          ],
          "blocking": true
        }
      ]
    },
    {
      "version": "0.3.0",
      "name": "normative core alpha",
      "channel": "experimental",
      "maturity_level": "M2",
      "objective": "Stabilise the candidate governance, security, schema, ontology and provenance contracts.",
      "required_tracks": [
        "foundation_architecture_20260718",
        "governance_maori_data_sovereignty_20260718",
        "security_supply_chain_20260719",
        "canonical_domain_schemas_ontology_20260719",
        "provenance_profile_v1_20260718"
      ],
      "exit_gates": [
        {
          "id": "core-schema-conformance",
          "category": "contracts",
          "requirement": "Candidate schemas, ontology, identifiers and migrations pass positive and negative conformance tests.",
          "evidence_contract": [
            "Schema corpus",
            "Ontology validation",
            "Migration fixtures"
          ],
          "blocking": true
        },
        {
          "id": "core-provenance-integrity",
          "category": "provenance",
          "requirement": "Capture, transformation, lineage, manual/AI assistance and integrity semantics work across representative event patterns.",
          "evidence_contract": [
            "Golden event streams",
            "Tamper and concurrency tests",
            "Lineage-granularity report"
          ],
          "blocking": true
        },
        {
          "id": "core-security-baseline",
          "category": "security",
          "requirement": "Threat model, dependency controls, secret handling and release-signing design have no unmitigated critical finding.",
          "evidence_contract": [
            "Threat model",
            "Security review",
            "CI and signing policy"
          ],
          "blocking": true
        },
        {
          "id": "core-governance-baseline",
          "category": "governance",
          "requirement": "Rights, privacy, Māori data sovereignty and release decision hooks are embedded in the contracts.",
          "evidence_contract": [
            "Governance review",
            "Rights fixtures",
            "Decision and escalation model"
          ],
          "blocking": true
        }
      ]
    },
    {
      "version": "0.4.0",
      "name": "real capture-to-research-object alpha",
      "channel": "experimental",
      "maturity_level": "M2",
      "objective": "Complete one real national and one council capture through a complete citable research object.",
      "required_tracks": [
        "methods_research_objects_20260718",
        "connector_runtime_capture_20260719",
        "nz_spatial_source_registry_20260718"
      ],
      "exit_gates": [
        {
          "id": "capture-real-sources",
          "category": "data",
          "requirement": "At least one national and one council/planning source complete faithful capture with rights and source-capability evidence.",
          "evidence_contract": [
            "Raw capture artifacts",
            "Capture provenance",
            "Rights and source reports"
          ],
          "blocking": true
        },
        {
          "id": "research-object-complete",
          "category": "publication",
          "requirement": "A closed research object contains payloads, methods, quality, rights, environment, citation, checksums and attestations.",
          "evidence_contract": [
            "RO-Crate validation",
            "Closed-bundle report",
            "Signed checksum and attestation set"
          ],
          "blocking": true
        },
        {
          "id": "vertical-slice-reproduction",
          "category": "provenance",
          "requirement": "A clean environment rebuilds the vertical slice with exact or declared tolerance-equivalent outputs.",
          "evidence_contract": [
            "Clean-room log",
            "Output comparison",
            "Environment manifest"
          ],
          "blocking": true
        },
        {
          "id": "vertical-slice-failure-tests",
          "category": "operations",
          "requirement": "Retry, partial failure, malformed input, source change and recovery paths are exercised.",
          "evidence_contract": [
            "Failure-injection report",
            "Quarantine/recovery evidence",
            "Diagnostic bundle"
          ],
          "blocking": true
        }
      ]
    },
    {
      "version": "0.5.0",
      "name": "New Zealand spatial archive alpha",
      "channel": "experimental",
      "maturity_level": "M3",
      "objective": "Operate a bounded real-data archive slice with canonical bitemporal records and reproducible materialisations.",
      "required_tracks": [
        "repository_template_adoption_20260718",
        "nz_spatial_archive_mvp_20260718"
      ],
      "exit_gates": [
        {
          "id": "spatial-canonical-model",
          "category": "data",
          "requirement": "Authority, source, layer, plan, feature and snapshot identities preserve original evidence and temporal semantics.",
          "evidence_contract": [
            "Canonical schema validation",
            "Bitemporal query examples",
            "Identity collision report"
          ],
          "blocking": true
        },
        {
          "id": "spatial-materialisations",
          "category": "interoperability",
          "requirement": "GeoParquet and DuckDB materialisations rebuild deterministically and pass compatibility checks.",
          "evidence_contract": [
            "Materialisation checksums",
            "Tool compatibility matrix",
            "Rebuild report"
          ],
          "blocking": true
        },
        {
          "id": "spatial-repository-adoption",
          "category": "contracts",
          "requirement": "Repository templates and at least two ecosystem adapters emit conforming evidence without losing native provenance.",
          "evidence_contract": [
            "Adapter mappings",
            "Template conformance report",
            "Migration findings"
          ],
          "blocking": true
        },
        {
          "id": "spatial-alpha-operations",
          "category": "operations",
          "requirement": "The bounded archive completes three scheduled cycles including one change and one failure/recovery path.",
          "evidence_contract": [
            "Cycle logs",
            "Change report",
            "Recovery evidence"
          ],
          "blocking": true
        }
      ]
    },
    {
      "version": "0.6.0",
      "name": "queryable planning, access and facility beta",